{
  "contract": "stepmeld/step-definition.v1",
  "name": "stepdef_multiply",
  "version": 1,
  "label": "Multiply by a factor",
  "description": "Multiplies value by factor, taking three beats so that its progress can be watched.",
  "program": "hello-program",
  "inputs": [
    {"name": "value", "tag": "integer", "required": true},
    {"name": "factor", "tag": "integer", "required": true}
  ],
  "parameters": [
    {"name": "beat-seconds", "tag": "number", "required": true, "default": 1, "label": "Seconds per beat"}
  ],
  "outputs": [
    {"name": "product", "tag": "integer"}
  ]
}
