{
  "contract": "stepmeld/step-definition.v1",
  "done_by": "performer",
  "inputs": [
    {
      "name": "notes",
      "required": true,
      "tag": "notes"
    }
  ],
  "name": "draft",
  "outputs": [
    {
      "name": "text",
      "tag": "text"
    }
  ],
  "parameters": [
    {
      "default": "plain",
      "name": "style",
      "required": false,
      "tag": "string"
    }
  ],
  "policy": {
    "on_failure": {
      "do": "stop"
    },
    "on_stale": "wait",
    "placement": {},
    "start": "automatic"
  },
  "program": "draft-program",
  "version": 1
}
