{
  "contract": "stepmeld/step-definition.v1",
  "done_by": "performer",
  "inputs": [
    {
      "name": "document",
      "required": true,
      "tag": "document"
    }
  ],
  "name": "publish",
  "outputs": [
    {
      "name": "release",
      "tag": "release"
    }
  ],
  "parameters": [],
  "policy": {
    "on_failure": {
      "do": "stop"
    },
    "on_stale": "wait",
    "placement": {},
    "start": "automatic"
  },
  "program": "publish-program",
  "version": 1
}
