{
  "contract": "stepmeld/step-definition.v1",
  "done_by": "performer",
  "inputs": [
    {
      "name": "text",
      "required": true,
      "tag": "text"
    }
  ],
  "name": "revise",
  "outputs": [
    {
      "name": "text",
      "tag": "text"
    }
  ],
  "parameters": [],
  "policy": {
    "on_failure": {
      "do": "stop"
    },
    "on_stale": "wait",
    "placement": {},
    "start": "automatic"
  },
  "program": "revise-program",
  "version": 1
}
